{
  "id": "698351",
  "email": "guest@example.com",
  "firstName": "Jordan",
  "lastName": "Rivera",
  "phone": "3125550142",
  "phoneCountryCode": "US",
  "zipCode": "60607",
  "imageUrl": "https://www.exploretock.com/example",
  "isoCountryCode": "US",
  "loyaltyProgramCardNumber": "example",
  "loyaltyProgramAccountId": "673995"
}